{
  "schema_version": "1.0",
  "case_id": "fictional_mismatch",
  "source_project": "parsehub_supplier",
  "source_commit": "bbbbbbbbbbbbbbbbbbbbbbbbbbbbbbbbbbbbbbbb",
  "platform": "fictional_social",
  "input_kind": "sanitized_fixture",
  "content_type": "multimedia",
  "title_present": true,
  "description_present": true,
  "author_present": true,
  "media_count": 1,
  "media": [
    {"index": 0, "type": "video", "role": "primary", "paired_group": "", "extension": "mp4", "width": 800, "height": 1200, "duration_ms": 6000, "size_bytes": 2500000, "size_is_estimate": true, "quality_label": "mobile", "hostname": "mismatch.example.invalid", "has_thumbnail": true, "has_video_pair": false}
  ],
  "elapsed_ms": 22,
  "outcome_class": "success",
  "error_class": "none",
  "credential_required": false,
  "network_executed": false,
  "notes": "Fictional mismatch fixture."
}
