{
  "schema_version": "1.0",
  "case_id": "fictional_mismatch",
  "source_project": "animeimages",
  "source_commit": "aaaaaaaaaaaaaaaaaaaaaaaaaaaaaaaaaaaaaaaa",
  "platform": "fictional_social",
  "input_kind": "sanitized_fixture",
  "content_type": "multimedia",
  "title_present": true,
  "description_present": true,
  "author_present": true,
  "media_count": 1,
  "media": [
    {"index": 0, "type": "image", "role": "gallery", "paired_group": "", "extension": "jpg", "width": 800, "height": 1200, "duration_ms": 0, "size_bytes": 100000, "size_is_estimate": false, "quality_label": "original", "hostname": "mismatch.example.invalid", "has_thumbnail": true, "has_video_pair": false}
  ],
  "elapsed_ms": 16,
  "outcome_class": "success",
  "error_class": "none",
  "credential_required": false,
  "network_executed": false,
  "notes": "Fictional mismatch fixture."
}
