{
  "schema_version": "1.0",
  "case_id": "fictional_single_video",
  "source_project": "animeimages",
  "source_commit": "aaaaaaaaaaaaaaaaaaaaaaaaaaaaaaaaaaaaaaaa",
  "platform": "fictional_video",
  "input_kind": "sanitized_fixture",
  "content_type": "video",
  "title_present": true,
  "description_present": true,
  "author_present": true,
  "media_count": 1,
  "media": [
    {
      "index": 0,
      "type": "video",
      "role": "primary",
      "paired_group": "",
      "extension": "mp4",
      "width": 1920,
      "height": 1080,
      "duration_ms": 12000,
      "size_bytes": 24000000,
      "size_is_estimate": false,
      "quality_label": "1080p",
      "hostname": "media.example.invalid",
      "has_thumbnail": true,
      "has_video_pair": false
    }
  ],
  "elapsed_ms": 40,
  "outcome_class": "success",
  "error_class": "none",
  "credential_required": false,
  "network_executed": false,
  "notes": "Fictional offline single-video fixture."
}
