{
  "schema_version": "1.0",
  "case_id": "fictional_multimedia",
  "source_project": "parsehub_supplier",
  "source_commit": "bbbbbbbbbbbbbbbbbbbbbbbbbbbbbbbbbbbbbbbb",
  "platform": "fictional_social",
  "input_kind": "sanitized_fixture",
  "content_type": "multimedia",
  "title_present": true,
  "description_present": true,
  "author_present": false,
  "media_count": 2,
  "media": [
    {"index": 0, "type": "image", "role": "gallery", "paired_group": "", "extension": "png", "width": 1000, "height": 1000, "duration_ms": 0, "size_bytes": 150000, "size_is_estimate": false, "quality_label": "original", "hostname": "mixed.example.invalid", "has_thumbnail": false, "has_video_pair": false},
    {"index": 1, "type": "video", "role": "primary", "paired_group": "", "extension": "mp4", "width": 1280, "height": 720, "duration_ms": 8000, "size_bytes": 7200000, "size_is_estimate": true, "quality_label": "720p", "hostname": "mixed.example.invalid", "has_thumbnail": true, "has_video_pair": false}
  ],
  "elapsed_ms": 42,
  "outcome_class": "success",
  "error_class": "none",
  "credential_required": false,
  "network_executed": false,
  "notes": "Fictional complete multimedia fixture."
}
